{
  "schema_version": "0.1.0",
  "run": {
    "id": "run-003",
    "timestamp": "2026-06-26T00:00:00Z",
    "tool_version": "0.1.0",
    "inputs_hash": "ghi789",
    "target_env": {
      "language": "python",
      "version": "3.11.4",
      "prefix": "/home/user/.venv"
    }
  },
  "claims": [
    {
      "id": "c-003",
      "type": "symbol",
      "subtype": "attribute",
      "text": "numpy.ufunc.reduce",
      "locus": { "file": "compute.py", "line": 7, "col": 2, "end_line": 7, "end_col": 20 },
      "verdict": "unverifiable",
      "confidence": 0.0,
      "evidence": [
        { "kind": "introspection", "detail": "numpy ufunc is a C extension; signature introspection not available", "determinism": "deterministic" }
      ],
      "verifier": { "name": "python-symbols", "version": "0.1.0", "determinism": "deterministic" }
    }
  ],
  "policy": {
    "backend": "local",
    "decision": "warn",
    "rules_applied": ["fail-on-contradicted"]
  },
  "summary": { "grounded": 0, "contradicted": 0, "unverifiable": 1 }
}
