{
  "schema_version": "0.1.0",
  "run": {
    "id": "run-002",
    "timestamp": "2026-06-26T00:00:00Z",
    "tool_version": "0.1.0",
    "inputs_hash": "def456",
    "target_env": {
      "language": "python",
      "version": "3.11.4",
      "prefix": "/home/user/.venv"
    }
  },
  "claims": [
    {
      "id": "c-002",
      "type": "symbol",
      "subtype": "attribute",
      "text": "pandas.DataFrame.append",
      "locus": { "file": "script.py", "line": 12, "col": 0, "end_line": 12, "end_col": 22 },
      "verdict": "contradicted",
      "confidence": 1.0,
      "evidence": [
        { "kind": "introspection", "detail": "pandas 2.1.0: DataFrame has no attribute 'append' (removed in 2.0)", "determinism": "deterministic" }
      ],
      "verifier": { "name": "python-symbols", "version": "0.1.0", "determinism": "deterministic" }
    }
  ],
  "policy": {
    "backend": "local",
    "decision": "fail",
    "rules_applied": ["fail-on-contradicted"]
  },
  "summary": { "grounded": 0, "contradicted": 1, "unverifiable": 0 }
}
